{
  "schemaVersion": 1,
  "purpose": "dsh-plugin-alpha2-fixed-runtime-probe",
  "authorityEffect": "contract-only-not-runtime-authority",
  "candidateExecuted": false,
  "catalogId": 3008,
  "baseline": {
    "tag": "dsh-v0.1.2-alpha.2",
    "commit": "0a53fb55bea101816fa226bb964ae2bed71c343b",
    "tree": "64ccbfa8e0caa4711cd4a75717ef9e022657961b"
  },
  "package": {
    "name": "@dsh-themes/dsh-view-modes",
    "version": "1.0.0-dsh.alpha2.1",
    "profile": "web",
    "cordisEntryId": "dsh-plugin-3008-view-modes"
  },
  "capabilities": {
    "permissions": [
      "read loaded prompt and response previews from the current Session's official Chat navigation index",
      "render verbose, normal, or summary windows inside one additive read-only Conversation View"
    ],
    "network": [],
    "processes": [],
    "files": [],
    "clientServices": [
      "slots",
      "uiConversation.binding(sessionId).target('chat')",
      "locale"
    ],
    "remoteMethods": [],
    "browserPersistence": "none"
  },
  "combination": {
    "additiveSlots": [
      "conversation.view:dsh-view-modes"
    ],
    "exclusiveResources": [],
    "officialSurfacePreserved": true
  },
  "assertions": [
    {
      "id": "package.exact-entry",
      "class": "package-graph",
      "expected": "The exact hosted package and Cordis entry occur once; every declared DeepSeek peer resolves to 0.1.2-alpha.2 and no removed aggregate runtime resolves."
    },
    {
      "id": "boot.ready-context-once",
      "class": "cold-web-boot",
      "expected": "A cold Web start reaches __DSH_BOOT_READY__; exactly one additive Conversation View entry and eight reversible locale dictionaries are present."
    },
    {
      "id": "feature.three-ephemeral-view-modes",
      "class": "feature-contract",
      "expected": "A direct click selects Verbose (all loaded previews), Normal (the six most recent), or Summary (the most recent) inside the plugin View; the choice stays only in the mounted React state and resets when the View closes or unloads."
    },
    {
      "id": "feature.official-conversation-context",
      "class": "feature-contract",
      "expected": "Fixed Chat target fixtures update through ChatSnapshot.navigation.items() from uiConversation.binding(sessionId).target('chat') without reading transcript markup, reconstructing event history, or changing the official Chat owner."
    },
    {
      "id": "security.official-additive-services-only",
      "class": "security-boundary",
      "expected": "The adaptation uses only official Slots, Conversation target binding, Chat navigation, and Locale contracts; it has no raw DOM, official Chat mutation, root/sidebar replacement, Remote, route, outbound request, credential, process, file, or browser-persistence capability."
    },
    {
      "id": "ui.keyboard-zoom-themes",
      "class": "accessibility-responsive",
      "expected": "The semantic heading, list, status text, and mode buttons inherit official theme and font styles; buttons remain keyboard operable with a programmatic pressed state and content remains readable in narrow layouts, 200 percent zoom, 12/14/17 pixel font settings, and light and dark schemes."
    },
    {
      "id": "dispose.zero-residue",
      "class": "teardown-rollback",
      "expected": "Removal leaves zero Conversation View entries, locale dictionaries, mounted React state, package rows, client graph entries, or dependency-closure changes, and governed Home and Profile bytes match the snapshot."
    },
    {
      "id": "combine.additive-slots-rollback",
      "class": "combination",
      "expected": "The uniquely identified additive View coexists with official Chat, trajectory, root, sidebar, settings, todo, and goal surfaces; full-batch rollback restores all prior entries after an injected later failure."
    }
  ]
}
